{
  "schema_version": 1,
  "run_id": "fixture-valid-001",
  "source": {
    "database_snapshot_sha256": "aaaaaaaaaaaaaaaaaaaaaaaaaaaaaaaaaaaaaaaaaaaaaaaaaaaaaaaaaaaaaaaa",
    "selected_ids_sha256": "a18f20bd9b3d2616decfefc9b190ff79591e0df30abda2e26a16990ee626f173",
    "source_code_commit": "d458bfebcac3db98a7db220843016cee614b7309",
    "runtime_version": "0.6.59 (schema v80)",
    "database_schema_version": 80,
    "content_redacted": true
  },
  "model": {
    "provider": "opencode",
    "model_id": "deepseek-v4-flash-fixture",
    "prompt_protocol_version": "memory-governance-v1",
    "input_schema_version": 1
  },
  "policy": {
    "confidence_threshold": 0.85,
    "max_batch_size": 50,
    "mutation_authorized": false
  },
  "records": [
    {
      "memory_id": 7,
      "row_snapshot_sha256": "bbbbbbbbbbbbbbbbbbbbbbbbbbbbbbbbbbbbbbbbbbbbbbbbbbbbbbbbbbbbbbbb",
      "verdict": "stale",
      "confidence": 0.93,
      "reason_codes": [
        "superseded_by_verified_claim"
      ],
      "evidence_refs": [
        "memory:9",
        "captured_event:101"
      ]
    },
    {
      "memory_id": 9,
      "row_snapshot_sha256": "cccccccccccccccccccccccccccccccccccccccccccccccccccccccccccccccc",
      "verdict": "abstain",
      "confidence": 0.42,
      "reason_codes": [
        "insufficient_evidence"
      ],
      "evidence_refs": []
    }
  ]
}
